,PUBMEDID,TITLE,AUTHORS,PUBICATION,PUBDATE,PUBYEAR
1387,15133611,Spinal and bulbar muscular atrophy: ligand-dependent pathogenesis and therapeutic perspectives.,"Katsuno M, Adachi H, Tanaka F, Sobue G.",J Mol Med (Berl). 2004 May;82(5):298-307. Epub 2004 Feb 27. Review.,5/11/2004,2004
1390,15146455,The androgen receptor gene mutations database (ARDB): 2004 update.,"Gottlieb B, Beitel LK, Wu JH, Trifiro M.",Hum Mutat. 2004 Jun;23(6):527-33. Erratum in: Hum Mutat. 2004 Jul;24(1):102.,5/18/2004,2004
1393,15151675,Kennedy's disease: pathogenesis and clinical approaches.,"Greenland KJ, Zajac JD.",Intern Med J. 2004 May;34(5):279-86. Review.,5/21/2004,2004
1396,15152038,Castration restores function and neurofilament alterations of aged symptomatic males in a transgenic mouse model of spinal and bulbar muscular atrophy.,"Chevalier-Larsen ES, O'Brien CJ, Wang H, Jenkins SC, Holder L, Lieberman AP, Merry DE.",J Neurosci. 2004 May 19;24(20):4778-86.,5/21/2004,2004
1399,15152501,[Development of therapeutics for spinal and bulbar muscular atrophy (SBMA)].,Sobue G.,Rinsho Shinkeigaku. 2003 Nov;43(11):909-11. Review. Japanese.,5/22/2004,2004
1402,15198988,Structural and functional consequences of glutamine tract variation in the androgen receptor.,"Buchanan G, Yang M, Cheong A, Harris JM, Irvine RA, Lambert PF, Moore NL, Raynor M, Neufing PJ, Coetzee GA, Tilley WD.",Hum Mol Genet. 2004 Aug 15;13(16):1677-92. Epub 2004 Jun 15.,6/17/2004,2004
1405,15225853,Function of androgen receptor in gene regulations.,"Kato S, Matsumoto T, Kawano H, Sato T, Takeyama K.",J Steroid Biochem Mol Biol. 2004 May;89-90(1-5):627-33.,7/1/2004,2004
1408,15240202,Muscle MRI findings of X-linked spinal and bulbar muscular atrophy.,"Hamano T, Mutoh T, Hirayama M, Kawamura Y, Nagata M, Fujiyama J, Kuriyama M.",J Neurol Sci. 2004 Jul 15;222(1-2):93-7.,7/9/2004,2004
1412,15258239,Five year follow up of a patient with spinal and bulbar muscular atrophy treated with leuprorelin.,"Shimohata T, Kimura T, Nishizawa M, Onodera O, Tsuji S.",J Neurol Neurosurg Psychiatry. 2004 Aug;75(8):1206-7. No abstract available.,7/20/2004,2004
1415,15297006,Clinical and electrophysiological features in Chinese patients with Kennedy's disease.,"Hui AC, Cheung PT, Tang AS, Fu M, Wong L, Kay R; Hong Kong Neuromuscular Disease Study Group.",Clin Neurol Neurosurg. 2004 Sep;106(4):309-12.,8/7/2004,2004
1418,15298288,[Development of the treatment for bulbospinal muscular atrophy].,"Katsuno M, Adachi H, Hanno H, Sobue G.",Nihon Naika Gakkai Zasshi. 2004 Jul 10;93(7):1466-72. Review. Japanese.  No abstract available.,8/10/2004,2004
1421,15313856,Bulbospinal muscular atrophy: Kennedy's disease.,"Sinnreich M, Klein CJ.",Arch Neurol. 2004 Aug;61(8):1324-6. No abstract available.,8/18/2004,2004
1425,15372378,A mutation in the vesicle-trafficking protein VAPB causes late-onset spinal muscular atrophy and amyotrophic lateral sclerosis.,"Nishimura AL, Mitne-Neto M, Silva HC, Richieri-Costa A, Middleton S, Cascio D, Kok F, Oliveira JR, Gillingwater T, Webb J, Skehel P, Zatz M.",Am J Hum Genet. 2004 Nov;75(5):822-31. Epub 2004 Sep 15.,9/17/2004,2004
1428,15376484,"Neurologic course, endocrine dysfunction and triplet repeat size in spinal bulbar muscular atrophy.","Sinnreich M, Sorenson EJ, Klein CJ.",Can J Neurol Sci. 2004 Aug;31(3):378-82.,9/21/2004,2004
1431,15506979,In vitro regulation of reporter gene transcription by the androgen receptor AF1 domain.,"Choudhry MA, McEwan IJ.",Biochem Soc Trans. 2004 Dec;32(Pt 6):1103-6.,10/28/2004,2004
1434,15519887,Intranuclear organization and function of the androgen receptor.,"Black BE, Paschal BM.",Trends Endocrinol Metab. 2004 Nov;15(9):411-7. Review.,11/3/2004,2004
1437,15524101,[Androgen receptor and male infertility].,"Eldar-Geva T, Milatiner D, Halle D.","Harefuah. 2004 Jun;143(6):432-9, 461. Review. Hebrew.",11/5/2004,2004
1440,15552866,[Treatment of spinal and bulbar muscular atrophy].,"Adachi H, Katsuno M, Sobue G.",No To Shinkei. 2004 Sep;56(9):772-9. Review. Japanese.  No abstract available.,11/24/2004,2004
1443,15589181,Transcranial magnetic stimulation in lower motor neuron diseases.,"Attarian S, Azulay JP, Lardillier D, Verschueren A, Pouget J.",Clin Neurophysiol. 2005 Jan;116(1):35-42.,12/14/2004,2004
1446,15609126,Increased frequency of long androgen receptor CAG repeats in male breast cancers.,"MacLean HE, Brown RW, Beilin J, Warne GL, Zajac JD.",Breast Cancer Res Treat. 2004 Dec;88(3):239-46.,12/21/2004,2004
1449,15642849,Polyglutamine diseases and transport problems: deadly traffic jams on neuronal highways.,"Gunawardena S, Goldstein LS.",Arch Neurol. 2005 Jan;62(1):46-51. Review.,1/12/2005,2005
1452,15659427,Widespread nuclear and cytoplasmic accumulation of mutant androgen receptor in SBMA patients.,"Adachi H, Katsuno M, Minamiyama M, Waza M, Sang C, Nakagomi Y, Kobayashi Y, Tanaka F, Doyu M, Inukai A, Yoshida M, Hashizume Y, Sobue G.",Brain. 2005 Mar;128(Pt 3):659-70. Epub 2005 Jan 19.,1/22/2005,2005
1455,15676109,Genetics and molecular pathogenesis of the myotonic dystrophies.,"Day JW, Ranum LP.",Curr Neurol Neurosci Rep. 2005 Feb;5(1):55-9. Review.,1/29/2005,2005
1458,15690183,The HumARA genotype is linked to spinal and bulbar muscular dystrophy and some further disease risks and should no longer be used as a DNA marker for forensic purposes.,"Szibor R, Hering S, Edelmann J.",Int J Legal Med. 2005 May;119(3):179-80. Epub 2005 Feb 3. No abstract available.,2/4/2005,2005
1461,15704143,Molecular diagnosis of inheritable neuromuscular disorders. Part II: Application of genetic testing in neuromuscular disease.,"Greenberg SA, Walsh RJ.",Muscle Nerve. 2005 Apr;31(4):431-51. Review.,2/11/2005,2005
1464,15728312,Laryngospasm: an underdiagnosed symptom of X-linked spinobulbar muscular atrophy.,"Sperfeld AD, Hanemann CO, Ludolph AC, Kassubek J.",Neurology. 2005 Feb 22;64(4):753-4.,2/25/2005,2005
1467,15785072,MR-pathologic comparison of the upper spinal cord in different motor neuron diseases.,"Sperfeld AD, Bretschneider V, Flaith L, Unrath A, Hanemann CO, Ludolph AC, Kassubek J.",Eur Neurol. 2005;53(2):74-7. Epub 2005 Mar 22.,3/24/2005,2005
1470,15799970,The unfolded protein response modulates toxicity of the expanded glutamine androgen receptor.,"Thomas M, Yu Z, Dadgar N, Varambally S, Yu J, Chinnaiyan AM, Lieberman AP.",J Biol Chem. 2005 Jun 3;280(22):21264-71. Epub 2005 Mar 30.,4/1/2005,2005
1473,15830083,X-linked spinal and bulbar muscular atrophy (Kennedy's disease) with long-term electrophysiological evaluation: case report.,"Kouyoumdjian JA, Morita Mda P, Araújo RG.",Arq Neuropsiquiatr. 2005 Mar;63(1):154-9. Epub 2005 Apr 13.,4/15/2005,2005
1476,15851746,A family with early-onset and rapidly progressive X-linked spinal and bulbar muscular atrophy.,"Echaniz-Laguna A, Rousso E, Anheim M, Cossée M, Tranchant C.",Neurology. 2005 Apr 26;64(8):1458-60.,4/27/2005,2005
1479,15876692,CAG repeat polymorphism in the androgen receptor (AR) gene of SBMA patients and a control group.,"Sułek A, Hoffman-Zacharska D, Krysa W, Szirkowiec W, Fidziańska E, Zaremba J.",J Appl Genet. 2005;46(2):237-9.,5/7/2005,2005
1482,15883271,Brachial amyotrophic diplegia in a patient with human immunodeficiency virus infection: widening the spectrum of motor neuron diseases occurring with the human immunodeficiency virus.,"Berger JR, Espinosa PS, Kissel J.",Arch Neurol. 2005 May;62(5):817-23. Review.,5/11/2005,2005
1485,15897156,Progress in Spinobulbar muscular atrophy research: insights into neuronal dysfunction caused by the polyglutamine-expanded androgen receptor.,"Beitel LK, Scanlon T, Gottlieb B, Trifiro MA.",Neurotox Res. 2005;7(3):219-30. Review.,5/18/2005,2005
1488,15924079,"[A clinical, neurophysiological and molecular study of 12 patients from 4 families with spinal and bulbar muscular atrophy].","Echaniz-Laguna A, Rousso E, Anheim M, Fleury M, Cossée M, Tranchant C.",Rev Neurol (Paris). 2005 Apr;161(4):437-44. French.,6/1/2005,2005
1491,15932358,Phenotypic variability in Kennedy's disease: implication of the early diagnostic features.,"Lee JH, Shin JH, Park KP, Kim IJ, Kim CM, Lim JG, Choi YC, Kim DS.",Acta Neurol Scand. 2005 Jul;112(1):57-63.,6/4/2005,2005
1494,15978183,Age-dependent differences in androgen binding affinity in a family with spinal and bulbar muscular atrophy.,"MacLean HE, Gonzales M, Greenland KJ, Warne GL, Zajac JD.",Neurol Res. 2005 Jul;27(5):548-51.,6/28/2005,2005
1497,15997639,[Kennedy's disease--case report].,"Tomczykiewicz K, Wrodycka B, Sułek A.",Pol Merkur Lekarski. 2005 Mar;18(105):307-9. Polish.,7/7/2005,2005
1500,16079302,Human expanded polyglutamine androgen receptor mutants in neurodegeneration as a novel ligand target.,"Furutani T, Takeyama K, Tanabe M, Koutoku H, Ito S, Taniguchi N, Suzuki E, Kudoh M, Shibasaki M, Shikama H, Kato S.",J Pharmacol Exp Ther. 2005 Nov;315(2):545-52. Epub 2005 Aug 3. Retraction in: J Pharmacol Exp Ther. 2014 Mar;348(3):493.,8/5/2005,2005
1503,16088611,Overview of neuromuscular disorders affecting respiratory function.,Gilchrist JM.,Semin Respir Crit Care Med. 2002 Jun;23(3):191-200.,8/10/2005,2005
1506,16091584,Study of androgen receptor functions by genetic models.,"Matsumoto T, Takeyama K, Sato T, Kato S.",J Biochem. 2005 Aug;138(2):105-10. Review.,8/11/2005,2005
1509,16100985,Kennedy's disease phenotype with positive genetic study for Kugelberg-Welander's disease: case report.,"Trentin AP, Scola RH, Teive HA, Raskin S, Germiniani FM, Werneck LC.",Arq Neuropsiquiatr. 2005 Jun;63(2A):330-1.,8/17/2005,2005
1512,16138977,"[""Jaw drop"" as an atypical manifestation of Kennedy's disease].","Larsen K, Smith TA.",Ugeskr Laeger. 2005 Aug 29;167(35):3310-1. Danish.,9/6/2005,2005
1515,16155577,"17-AAG, an Hsp90 inhibitor, ameliorates polyglutamine-mediated motor neuron degeneration.","Waza M, Adachi H, Katsuno M, Minamiyama M, Sang C, Tanaka F, Inukai A, Doyu M, Sobue G.",Nat Med. 2005 Oct;11(10):1088-95. Epub 2005 Sep 11.,9/13/2005,2005
1518,16225946,"Underediting of GluR2 mRNA, a neuronal death inducing molecular change in sporadic ALS, does not occur in motor neurons in ALS1 or SBMA.","Kawahara Y, Sun H, Ito K, Hideyama T, Aoki M, Sobue G, Tsuji S, Kwak S.",Neurosci Res. 2006 Jan;54(1):11-4. Epub 2005 Oct 12.,10/18/2005,2005
1522,16260738,Pharmacological induction of heat-shock proteins alleviates polyglutamine-mediated motor neuron disease.,"Katsuno M, Sang C, Adachi H, Minamiyama M, Waza M, Tanaka F, Doyu M, Sobue G.",Proc Natl Acad Sci U S A. 2005 Nov 15;102(46):16801-6. Epub 2005 Oct 31.,11/2/2005,2005
1525,16319030,Dementia of frontal lobe type in Kennedy's disease.,"Kessler H, Prudlo J, Kraft S, Supprian T.",Amyotroph Lateral Scler Other Motor Neuron Disord. 2005 Dec;6(4):250-3.,12/2/2005,2005
1528,16358333,Mutant androgen receptor accumulation in spinal and bulbar muscular atrophy scrotal skin: a pathogenic marker.,"Banno H, Adachi H, Katsuno M, Suzuki K, Atsuta N, Watanabe H, Tanaka F, Doyu M, Sobue G.",Ann Neurol. 2006 Mar;59(3):520-6.,12/17/2005,2005
1531,16388114,Reflections on the diseases linked to mutations of the androgen receptor.,"Poletti A, Negri-Cesi P, Martini L.",Endocrine. 2005 Dec;28(3):243-62. Review.,1/3/2006,2006
1535,16389310,Animal models of Kennedy disease.,Merry DE.,NeuroRx. 2005 Jul;2(3):471-9. Review.,1/4/2006,2006
1539,16400023,Abnormalities of germ cell maturation and sertoli cell cytoskeleton in androgen receptor 113 CAG knock-in mice reveal toxic effects of the mutant protein.,"Yu Z, Dadgar N, Albertelli M, Scheller A, Albin RL, Robins DM, Lieberman AP.",Am J Pathol. 2006 Jan;168(1):195-204.,1/10/2006,2006
1542,16407992,Small-molecule ligand induces nucleotide flipping in (CAG)n trinucleotide repeats.,"Nakatani K, Hagihara S, Goto Y, Kobori A, Hagihara M, Hayashi G, Kyo M, Nomura M, Mishima M, Kojima C.",Nat Chem Biol. 2005 Jun;1(1):39-43. Epub 2005 May 24.,1/13/2006,2006
1545,16467955,Comparison of androgen receptor CAG and GGN repeat length polymorphism in humans and apes.,"Hong KW, Hibino E, Takenaka O, Hayasaka I, Murayama Y, Ito S, Inoue-Murayama M.",Primates. 2006 Jul;47(3):248-54. Epub 2006 Feb 9.,2/10/2006,2006
1548,16503123,Genetics of familial and sporadic amyotrophic lateral sclerosis.,"Gros-Louis F, Gaspar C, Rouleau GA.",Biochim Biophys Acta. 2006 Nov-Dec;1762(11-12):956-72. Epub 2006 Feb 10. Review.,3/1/2006,2006
1551,16506152,Cortical versus spinal dysfunction in amyotrophic lateral sclerosis.,"Attarian S, Vedel JP, Pouget J, Schmied A.",Muscle Nerve. 2006 May;33(5):677-90.,3/1/2006,2006
1554,16513111,"Pathogenesis, animal models and therapeutics in spinal and bulbar muscular atrophy (SBMA).","Katsuno M, Adachi H, Waza M, Banno H, Suzuki K, Tanaka F, Doyu M, Sobue G.",Exp Neurol. 2006 Jul;200(1):8-18. Epub 2006 Mar 2. Review.,3/4/2006,2006
1557,16601069,Replacing the mouse androgen receptor with human alleles demonstrates glutamine tract length-dependent effects on physiology and tumorigenesis in mice.,"Albertelli MA, Scheller A, Brogley M, Robins DM.",Mol Endocrinol. 2006 Jun;20(6):1248-60. Epub 2006 Apr 6.,4/8/2006,2006
1560,16621916,Natural history of spinal and bulbar muscular atrophy (SBMA): a study of 223 Japanese patients.,"Atsuta N, Watanabe H, Ito M, Banno H, Suzuki K, Katsuno M, Tanaka F, Tamakoshi A, Sobue G.",Brain. 2006 Jun;129(Pt 6):1446-55. Epub 2006 Apr 18.,4/20/2006,2006
1563,16644868,Pharmacologic and genetic inhibition of hsp90-dependent trafficking reduces aggregation and promotes degradation of the expanded glutamine androgen receptor without stress protein induction.,"Thomas M, Harrell JM, Morishima Y, Peng HM, Pratt WB, Lieberman AP.",Hum Mol Genet. 2006 Jun 1;15(11):1876-83. Epub 2006 Apr 27.,4/29/2006,2006
1566,16642929,"[The most probable clinical diagnosis to the applicants for the intractable disease registration of Parkinson's disease, spinocerebellar degeneration and amyotrophic lateral sclerosis].","Narita Y, Taniguchi A, Kuzuhara S.",Rinsho Shinkeigaku. 2006 Mar;46(3):193-8. Japanese.,4/29/2006,2006
1569,16691593,Covariation of corticospinal efficiency and silent period in motoneuron diseases.,"Attarian S, Pouget J, Schmied A.",Muscle Nerve. 2006 Aug;34(2):178-88.,5/13/2006,2006
1572,16720620,Biologically active molecules that reduce polyglutamine aggregation and toxicity.,"Desai UA, Pallos J, Ma AA, Stockwell BR, Thompson LM, Marsh JL, Diamond MI.",Hum Mol Genet. 2006 Jul 1;15(13):2114-24. Epub 2006 May 23.,5/25/2006,2006
1575,16741751,Modulation of Hsp90 function in neurodegenerative disorders: a molecular-targeted therapy against disease-causing protein.,"Waza M, Adachi H, Katsuno M, Minamiyama M, Tanaka F, Doyu M, Sobue G.",J Mol Med (Berl). 2006 Aug;84(8):635-46. Epub 2006 Jun 2. Review.,6/3/2006,2006
1578,16751763,JNK mediates pathogenic effects of polyglutamine-expanded androgen receptor on fast axonal transport.,"Morfini G, Pigino G, Szebenyi G, You Y, Pollema S, Brady ST.",Nat Neurosci. 2006 Jul;9(7):907-16. Epub 2006 Jun 4.,6/6/2006,2006
1581,16753970,A phenotypic-genetic study of a group of Polish patients with spinal and bulbar muscular atrophy.,"Tomik B, Partyka D, Sułek A, Kurek-Gryz EA, Banach M, Ostrowska M, Zaremba J, Figlewicz DA, Szczudlik A.",Amyotroph Lateral Scler. 2006 Jun;7(2):72-9.,6/7/2006,2006
1584,16772330,Loss of endogenous androgen receptor protein accelerates motor neuron degeneration and accentuates androgen insensitivity in a mouse model of X-linked spinal and bulbar muscular atrophy.,"Thomas PS Jr, Fraley GS, Damian V, Woodke LB, Zapata F, Sopher BL, Plymate SR, La Spada AR.","Hum Mol Genet. 2006 Jul 15;15(14):2225-38. Epub 2006 Jun 13. Erratum in: Hum Mol Genet. 2006 Oct 1;15(19):2972. Damien, Vincent [corrected to Damian, Vincent].",6/15/2006,2006
1587,16781019,Aggregation and proteasome: the case of elongated polyglutamine aggregation in spinal and bulbar muscular atrophy.,"Rusmini P, Sau D, Crippa V, Palazzolo I, Simonini F, Onesto E, Martini L, Poletti A.",Neurobiol Aging. 2007 Jul;28(7):1099-111. Epub 2006 Jun 15.,6/20/2006,2006
1590,16782802,Huntingtin-associated protein 1 (HAP1) interacts with androgen receptor (AR) and suppresses SBMA-mutant-AR-induced apoptosis.,"Takeshita Y, Fujinaga R, Zhao C, Yanai A, Shinoda K.",Hum Mol Genet. 2006 Aug 1;15(15):2298-312. Epub 2006 Jun 16.,6/20/2006,2006
1593,16793767,Archaeal proteasomes effectively degrade aggregation-prone proteins and reduce cellular toxicities in mammalian cells.,"Yamada S, Niwa J, Ishigaki S, Takahashi M, Ito T, Sone J, Doyu M, Sobue G.",J Biol Chem. 2006 Aug 18;281(33):23842-51. Epub 2006 Jun 22.,6/24/2006,2006
1596,16892542,[Clinical consequences of androgen receptor malfunction].,"Klocker H, Eder IE, Culig Z, Bartsch G.",Verh Dtsch Ges Pathol. 2004;88:122-9. Review. German.,8/9/2006,2006
1599,16980958,Cytosolic chaperonin prevents polyglutamine toxicity with altering the aggregation state.,"Kitamura A, Kubota H, Pack CG, Matsumoto G, Hirayama S, Takahashi Y, Kimura H, Kinjo M, Morimoto RI, Nagata K.",Nat Cell Biol. 2006 Oct;8(10):1163-70. Epub 2006 Sep 17.,9/19/2006,2006
1603,16981011,Androgen-dependent pathology demonstrates myopathic contribution to the Kennedy disease phenotype in a mouse knock-in model.,"Yu Z, Dadgar N, Albertelli M, Gruis K, Jordan C, Robins DM, Lieberman AP.",J Clin Invest. 2006 Oct;116(10):2663-72. Epub 2006 Sep 14.,9/19/2006,2006
1606,17001815,Canadian Association of Neurosciences Review: polyglutamine expansion neurodegenerative diseases.,"Truant R, Raymond LA, Xia J, Pinchev D, Burtnik A, Atwal RS.",Can J Neurol Sci. 2006 Aug;33(3):278-91. Review.,9/28/2006,2006
1609,17055185,The androgen receptor gene: a major modifier of speed of neuronal transmission and intelligence?,Manning JT.,Med Hypotheses. 2007;68(4):802-4. Epub 2006 Oct 19.,10/24/2006,2006
1612,17056629,Administration of testosterone results in reversible deterioration in Kennedy's disease.,"Kinirons P, Rouleau GA.",J Neurol Neurosurg Psychiatry. 2008 Jan;79(1):106-7. Epub 2006 Oct 20. No abstract available.,10/24/2006,2006
1615,17073759,Structural dynamics of the human androgen receptor: implications for prostate cancer and neurodegenerative disease.,"Duff J, Davies P, Watt K, McEwan IJ.",Biochem Soc Trans. 2006 Dec;34(Pt 6):1098-102.,11/1/2006,2006
1618,17121819,Soluble androgen receptor oligomers underlie pathology in a mouse model of spinobulbar muscular atrophy.,"Li M, Chevalier-Larsen ES, Merry DE, Diamond MI.",J Biol Chem. 2007 Feb 2;282(5):3157-64. Epub 2006 Nov 22.,11/24/2006,2006
1621,17122035,Reversible disruption of dynactin 1-mediated retrograde axonal transport in polyglutamine-induced motor neuron degeneration.,"Katsuno M, Adachi H, Minamiyama M, Waza M, Tokui K, Banno H, Suzuki K, Onoda Y, Tanaka F, Doyu M, Sobue G.",J Neurosci. 2006 Nov 22;26(47):12106-17.,11/24/2006,2006
1624,17128093,[Differential diagnosis and atypical subsets of amyotrophic lateral sclerosis].,"Pradat PF, Bruneteau G.",Rev Neurol (Paris). 2006 Jun;162 Spec No 2:4S81-4S90. French.,11/28/2006,2006
1627,17128094,[What is the role of the genetic survey in amyotrophic lateral sclerosis?].,Camu W.,Rev Neurol (Paris). 2006 Jun;162 Spec No 2:4S91-4S95. French.,11/28/2006,2006
1630,17128090,[What is the role of other complementary examination in amyotrophic lateral sclerosis?].,Tranchant C.,Rev Neurol (Paris). 2006 Jun;162 Spec No 2:4S50-4S56. French.,11/28/2006,2006
1633,17128092,[Amyotrophic lateral sclerosis: differential diagnosis and frontier forms].,Magistris MR.,Rev Neurol (Paris). 2006 Jun;162 Spec No 2:4S67-4S80. French.,11/28/2006,2006
1636,17128087,[Clinical characteristics of amyotrophic lateral sclerosis subsets].,"Pradat PF, Bruneteau G.",Rev Neurol (Paris). 2006 Jun;162 Spec No 2:4S29-4S33. French.,11/28/2006,2006
1639,17137837,Upper motor neuron involvement in X-linked recessive bulbospinal muscular atrophy.,"Pachatz C, Terracciano C, Desiato MT, Orlacchio A, Mori F, Rocchi C, Bernardi G, Massa R.",Clin Neurophysiol. 2007 Feb;118(2):262-8. Epub 2006 Nov 29.,12/2/2006,2006
1642,17185503,Alleviating neurodegeneration by an anticancer agent: an Hsp90 inhibitor (17-AAG).,"Waza M, Adachi H, Katsuno M, Minamiyama M, Tanaka F, Sobue G.",Ann N Y Acad Sci. 2006 Nov;1086:21-34. Review.,12/23/2006,2006
1645,17276991,Ubiquitin-interacting motifs inhibit aggregation of polyQ-expanded huntingtin.,"Miller SL, Scappini EL, O'Bryan J.",J Biol Chem. 2007 Mar 30;282(13):10096-103. Epub 2007 Feb 2.,2/6/2007,2007
1648,17299742,Frequent atrophic groups with mixed-type myofibers is distinctive to motor neuron syndromes.,"Baloh RH, Rakowicz W, Gardner R, Pestronk A.",Muscle Nerve. 2007 Jul;36(1):107-10.,2/15/2007,2007
1652,17332050,Widespread white matter changes in Kennedy disease: a voxel based morphometry study.,"Kassubek J, Juengling FD, Sperfeld AD.",J Neurol Neurosurg Psychiatry. 2007 Nov;78(11):1209-12. Epub 2007 Mar 1.,3/3/2007,2007
1655,17334372,ASC-J9 ameliorates spinal and bulbar muscular atrophy phenotype via degradation of androgen receptor.,"Yang Z, Chang YJ, Yu IC, Yeh S, Wu CC, Miyamoto H, Merry DE, Sobue G, Chen LM, Chang SS, Chang C.",Nat Med. 2007 Mar;13(3):348-53. Epub 2007 Mar 4.,3/6/2007,2007
1658,17359355,Pathogenesis and molecular targeted therapy of spinal and bulbar muscular atrophy.,"Adachi H, Waza M, Katsuno M, Tanaka F, Doyu M, Sobue G.",Neuropathol Appl Neurobiol. 2007 Apr;33(2):135-51. Review.,3/16/2007,2007
1661,17364438,Elevated creatine kinase and transaminases in asymptomatic SBMA.,"Sorenson EJ, Klein CJ.",Amyotroph Lateral Scler. 2007 Feb;8(1):62-4.,3/17/2007,2007
1664,17426712,Hsp40 molecules that target to the ubiquitin-proteasome system decrease inclusion formation in models of polyglutamine disease.,"Howarth JL, Kelly S, Keasey MP, Glover CP, Lee YB, Mitrophanous K, Chapple JP, Gallo JM, Cheetham ME, Uney JB.",Mol Ther. 2007 Jun;15(6):1100-5. Epub 2007 Apr 10.,4/12/2007,2007
1667,17447526,[Therapeutic strategies for the polyglutamine diseases].,"Nagai Y, Popiel HA, Fujikake N, Toda T.",Brain Nerve. 2007 Apr;59(4):393-404. Review. Japanese.,4/24/2007,2007
1670,17447523,[Paradigm shift in clinical trials for neurodegenerative diseases].,"Katsuno M, Banno H, Suzuki K, Takeuchi Y, Sobue G.",Brain Nerve. 2007 Apr;59(4):367-74. Review. Japanese.,4/24/2007,2007
1673,17470458,Akt blocks ligand binding and protects against expanded polyglutamine androgen receptor toxicity.,"Palazzolo I, Burnett BG, Young JE, Brenne PL, La Spada AR, Fischbeck KH, Howell BW, Pennuto M.",Hum Mol Genet. 2007 Jul 1;16(13):1593-603. Epub 2007 Apr 30.,5/2/2007,2007
1676,17484138,Small molecule modulators in epigenetics: implications in gene expression and therapeutics.,"Swaminathan V, Reddy BA, Ruthrotha Selvi B, Sukanya MS, Kundu TK.",Subcell Biochem. 2007;41:397-428. Review.,5/9/2007,2007
1679,17494697,CHIP overexpression reduces mutant androgen receptor protein and ameliorates phenotypes of the spinal and bulbar muscular atrophy transgenic mouse model.,"Adachi H, Waza M, Tokui K, Katsuno M, Minamiyama M, Tanaka F, Doyu M, Sobue G.",J Neurosci. 2007 May 9;27(19):5115-26.,5/15/2007,2007
1682,17568747,HDAC6 rescues neurodegeneration and provides an essential link between autophagy and the UPS.,"Pandey UB, Nie Z, Batlevi Y, McCray BA, Ritson GP, Nedelsky NB, Schwartz SL, DiProspero NA, Knight MA, Schuldiner O, Padmanabhan R, Hild M, Berry DL, Garza D, Hubbert CC, Yao TP, Baehrecke EH, Taylor JP.",Nature. 2007 Jun 14;447(7146):859-63.,6/15/2007,2007
1685,17596176,Men with Kennedy disease have a reduced risk of androgenetic alopecia.,"Sinclair R, Greenland KJ, Egmond Sv, Hoedemaker C, Chapman A, Zajac JD.",Br J Dermatol. 2007 Aug;157(2):290-4. Epub 2007 Jun 26.,6/29/2007,2007
1688,17611709,"Nationwide survey on predictive genetic testing for late-onset, incurable neurological diseases in Japan.","Yoshida K, Wada T, Sakurai A, Wakui K, Ikeda S, Fukushima Y.",J Hum Genet. 2007;52(8):675-9. Epub 2007 Jul 5.,7/6/2007,2007
1691,17691102,Small-fiber involvement in spinobulbar muscular atrophy (Kennedy's disease).,"Manganelli F, Iodice V, Provitera V, Pisciotta C, Nolano M, Perretti A, Santoro L.",Muscle Nerve. 2007 Dec;36(6):816-20.,8/11/2007,2007
1694,17720200,Depletion of mitochondrial DNA in leukocytes of patients with poly-Q diseases.,"Liu CS, Cheng WL, Kuo SJ, Li JY, Soong BW, Wei YH.",J Neurol Sci. 2008 Jan 15;264(1-2):18-21. Epub 2007 Aug 27.,8/28/2007,2007
1697,17786457,CAG repeat disorder models and human neuropathology: similarities and differences.,"Yamada M, Sato T, Tsuji S, Takahashi H.",Acta Neuropathol. 2008 Jan;115(1):71-86. Epub 2007 Sep 5. Review.,9/6/2007,2007
1700,17803850,[Clinical manifestations and molecular genetics of spinal bulbar muscular atrophy: report of 5 cases].,"Li XH, Zhuang JJ, Xie QY, Li AP, Liang XL, Feng YQ, Fang YY, Li JR, Liang YX.",Zhonghua Yi Xue Za Zhi. 2007 Jun 19;87(23):1611-5. Chinese.,9/7/2007,2007
1703,17803031,Multimodal evoked potentials of Kennedy's disease.,"Lai TH, Soong BW, Chen JT, Chen YY, Lai KL, Wu ZA, Liao KK.",Can J Neurol Sci. 2007 Aug;34(3):328-32.,9/7/2007,2007
1706,17852020,Pure bulbar motor neuron involvement linked to an abnormal CAG repeat expansion in the androgen receptor gene.,"Praline J, Guennoc AM, Malinge MC, de Toffol B, Corcia P.",Amyotroph Lateral Scler. 2008 Feb;9(1):40-2.,9/14/2007,2007
1709,17854832,Spinal and bulbar muscular atrophy: skeletal muscle pathology in male patients and heterozygous females.,"Sorarù G, D'Ascenzo C, Polo A, Palmieri A, Baggio L, Vergani L, Gellera C, Moretto G, Pegoraro E, Angelini C.",J Neurol Sci. 2008 Jan 15;264(1-2):100-5. Epub 2007 Sep 12.,9/15/2007,2007
1713,17868456,HAP1 can sequester a subset of TBP in cytoplasmic inclusions via specific interaction with the conserved TBP(CORE).,"Prigge JR, Schmidt EE.",BMC Mol Biol. 2007 Sep 14;8:76.,9/18/2007,2007
1716,17881894,Androgen receptor modulation: lessons learned from beyond the prostate.,"Sharifi N, Figg WD.",Cancer Biol Ther. 2007 Sep;6(9):1358-9. Epub 2007 Aug 3. Review.,9/21/2007,2007
