,PUBMEDID,TITLE,AUTHORS,PUBICATION,PUBDATE,PUBYEAR
2047,20336775,B2 attenuates polyglutamine-expanded androgen receptor toxicity in cell and fly models of spinal and bulbar muscular atrophy.,"Palazzolo I, Nedelsky NB, Askew CE, Harmison GG, Kasantsev AG, Taylor JP, Fischbeck KH, Pennuto M.",J Neurosci Res. 2010 Aug 1;88(10):2207-16. doi: 10.1002/jnr.22389.,3/26/2010,2010
2051,20348093,Inhibition of hsp70 by methylene blue affects signaling protein function and ubiquitination and modulates polyglutamine protein degradation.,"Wang AM, Morishima Y, Clapp KM, Peng HM, Pratt WB, Gestwicki JE, Osawa Y, Lieberman AP.",J Biol Chem. 2010 May 21;285(21):15714-23. doi: 10.1074/jbc.M109.098806. Epub 2010 Mar 26.,3/30/2010,2010
2054,20376789,"[Study on clinical manifestation, genotype and genetic characteristics of two Kennedy disease pedigrees].","Yang J, Zhang C, Hu ZH, Zhan YX, Cao JQ, Ren H.",Zhonghua Yi Xue Yi Chuan Xue Za Zhi. 2010 Apr;27(2):125-31. doi: 10.3760/cma.j.issn.1003-9406.2010.02.002. Chinese.,4/9/2010,2010
2058,20395441,DNAJB2 expression in normal and diseased human and mouse skeletal muscle.,"Claeys KG, Sozanska M, Martin JJ, Lacene E, Vignaud L, Stockholm D, Laforêt P, Eymard B, Kichler A, Scherman D, Voit T, Israeli D.",Am J Pathol. 2010 Jun;176(6):2901-10. doi: 10.2353/ajpath.2010.090663. Epub 2010 Apr 15.,4/17/2010,2010
2061,20410122,Disrupted transforming growth factor-beta signaling in spinal and bulbar muscular atrophy.,"Katsuno M, Adachi H, Minamiyama M, Waza M, Doi H, Kondo N, Mizoguchi H, Nitta A, Yamada K, Banno H, Suzuki K, Tanaka F, Sobue G.",J Neurosci. 2010 Apr 21;30(16):5702-12. doi: 10.1523/JNEUROSCI.0388-10.2010.,4/23/2010,2010
2064,20441310,Spontaneous formation of polyglutamine nanotubes with molecular dynamics simulations.,"Laghaei R, Mousseau N.",J Chem Phys. 2010 Apr 28;132(16):165102. doi: 10.1063/1.3383244.,5/6/2010,2010
2068,20495529,A simple composite phenotype scoring system for evaluating mouse models of cerebellar ataxia.,"Guyenet SJ, Furrer SA, Damian VM, Baughan TD, La Spada AR, Garden GA.",J Vis Exp. 2010 May 21;(39). doi:pii: 1787.  10.3791/1787.,5/25/2010,2010
2071,20502504,Current understanding on the pathogenesis of polyglutamine diseases.,"He XH, Lin F, Qin ZH.",Neurosci Bull. 2010 Jun;26(3):247-56. doi: 10.1007/s12264-010-0113-2. Review.,5/27/2010,2010
2074,20500522,"EFNS guidelines for the molecular diagnosis of neurogenetic disorders: motoneuron, peripheral nerve and muscle disorders.","Burgunder JM, Schöls L, Baets J, Andersen P, Gasser T, Szolnoki Z, Fontaine B, Van Broeckhoven C, Di Donato S, De Jonghe P, Lynch T, Mariotti C, Spinazzola A, Tabrizi SJ, Tallaksen C, Zeviani M, Harbo HF, Finsterer J; EFNS.",Eur J Neurol. 2011 Feb;18(2):207-17. doi: 10.1111/j.1468-1331.2010.03069.x.,5/27/2010,2010
2077,20621188,Proteasomal and autophagic degradative activities in spinal and bulbar muscular atrophy.,"Rusmini P, Bolzoni E, Crippa V, Onesto E, Sau D, Galbiati M, Piccolella M, Poletti A.",Neurobiol Dis. 2010 Nov;40(2):361-9. doi: 10.1016/j.nbd.2010.06.016. Epub 2010 Jul 16. Review.,7/14/2010,2010
2081,20644736,Novel antibodies reveal inclusions containing non-native SOD1 in sporadic ALS patients.,"Forsberg K, Jonsson PA, Andersen PM, Bergemalm D, Graffmo KS, Hultdin M, Jacobsson J, Rosquist R, Marklund SL, Brännström T.",PLoS One. 2010 Jul 14;5(7):e11552. doi: 10.1371/journal.pone.0011552.,7/21/2010,2010
2085,20689246,Prenatal flutamide enhances survival in a myogenic mouse model of spinal bulbar muscular atrophy.,"Johansen JA, Troxell-Smith SM, Yu Z, Mo K, Monks DA, Lieberman AP, Breedlove SM, Jordan CL.",Neurodegener Dis. 2011;8(1-2):25-34. doi: 10.1159/000313682. Epub 2010 Aug 4.,8/7/2010,2010
2088,20687495,Clinical features and molecular mechanisms of spinal and bulbar muscular atrophy (SBMA).,"Katsuno M, Banno H, Suzuki K, Adachi H, Tanaka F, Sobue G.",Adv Exp Med Biol. 2010;685:64-74. Review.,8/7/2010,2010
2091,20691640,Renewed hope for treatment of spinal and bulbar muscular atrophy?,Dengler R.,Lancet Neurol. 2010 Sep;9(9):845-6. doi: 10.1016/S1474-4422(10)70186-1. Epub 2010 Aug 4. No abstract available.,8/10/2010,2010
2094,20691641,"Efficacy and safety of leuprorelin in patients with spinal and bulbar muscular atrophy (JASMITT study): a multicentre, randomised, double-blind, placebo-controlled trial.","Katsuno M, Banno H, Suzuki K, Takeuchi Y, Kawashima M, Yabe I, Sasaki H, Aoki M, Morita M, Nakano I, Kanai K, Ito S, Ishikawa K, Mizusawa H, Yamamoto T, Tsuji S, Hasegawa K, Shimohata T, Nishizawa M, Miyajima H, Kanda F, Watanabe Y, et al.",Lancet Neurol. 2010 Sep;9(9):875-84. doi: 10.1016/S1474-4422(10)70182-4. Epub 2010 Aug 4.,8/10/2010,2010
2097,20816782,17-AAG increases autophagic removal of mutant androgen receptor in spinal and bulbar muscular atrophy.,"Rusmini P, Simonini F, Crippa V, Bolzoni E, Onesto E, Cagnin M, Sau D, Ferri N, Poletti A.",Neurobiol Dis. 2011 Jan;41(1):83-95. doi: 10.1016/j.nbd.2010.08.023. Epub 2010 Sep 9.,9/8/2010,2010
2101,20826431,Global gene expression profiling of somatic motor neuron populations with different vulnerability identify molecules and pathways of degeneration and protection.,"Hedlund E, Karlsson M, Osborn T, Ludwig W, Isacson O.",Brain. 2010 Aug;133(Pt 8):2313-30. doi: 10.1093/brain/awq167.,9/10/2010,2010
2105,20826791,An interdomain interaction of the androgen receptor is required for its aggregation and toxicity in spinal and bulbar muscular atrophy.,"Orr CR, Montie HL, Liu Y, Bolzoni E, Jenkins SC, Wilson EM, Joseph JD, McDonnell DP, Merry DE.",J Biol Chem. 2010 Nov 12;285(46):35567-77. doi: 10.1074/jbc.M110.146845. Epub 2010 Sep 8.,9/10/2010,2010
2108,20840067,Skeletal muscle in motor neuron diseases: therapeutic target and delivery route for potential treatments.,"Dupuis L, Echaniz-Laguna A.",Curr Drug Targets. 2010 Oct;11(10):1250-61. Review.,9/16/2010,2010
2111,20846673,Perspectives of Kennedy's disease.,Finsterer J.,J Neurol Sci. 2010 Nov 15;298(1-2):1-10. doi: 10.1016/j.jns.2010.08.025. Epub 2010 Sep 16. Review.,9/18/2010,2010
2115,20863580,Therapeutic approaches to spinal and bulbar muscular atrophy.,"Ranganathan S, Fischbeck KH.",Trends Pharmacol Sci. 2010 Nov;31(11):523-7. doi: 10.1016/j.tips.2010.08.005. Epub 2010 Sep 20. Review.,9/25/2010,2010
2119,20869592,Native functions of the androgen receptor are essential to pathogenesis in a Drosophila model of spinobulbar muscular atrophy.,"Nedelsky NB, Pennuto M, Smith RB, Palazzolo I, Moore J, Nie Z, Neale G, Taylor JP.",Neuron. 2010 Sep 23;67(6):936-52. doi: 10.1016/j.neuron.2010.08.034.,9/28/2010,2010
2123,20886071,Microarray analysis of gene expression by skeletal muscle of three mouse models of Kennedy disease/spinal bulbar muscular atrophy.,"Mo K, Razak Z, Rao P, Yu Z, Adachi H, Katsuno M, Sobue G, Lieberman AP, Westwood JT, Monks DA.",PLoS One. 2010 Sep 23;5(9):e12922. doi: 10.1371/journal.pone.0012922.,10/5/2010,2010
2126,21092480,[Clinical features and genetic diagnosis of Kennedy disease].,"Xie MQ, Li XG, Cui LY, Liu MS, Li BH, Zhao YH.",Zhonghua Yi Xue Za Zhi. 2010 Sep 21;90(35):2498-500. Chinese.,11/26/2010,2010
2129,21189118,Transforming growth factor-β signaling in motor neuron diseases.,"Katsuno M, Adachi H, Banno H, Suzuki K, Tanaka F, Sobue G.",Curr Mol Med. 2011 Feb;11(1):48-56. Review.,12/30/2010,2010
2133,21216197,Efficacy and safety of dutasteride in patients with spinal and bulbar muscular atrophy: a randomised placebo-controlled trial.,"Fernández-Rhodes LE, Kokkinis AD, White MJ, Watts CA, Auh S, Jeffries NO, Shrader JA, Lehky TJ, Li L, Ryder JE, Levy EW, Solomon BI, Harris-Love MO, La Pean A, Schindler AB, Chen C, Di Prospero NA, Fischbeck KH.",Lancet Neurol. 2011 Feb;10(2):140-7. doi: 10.1016/S1474-4422(10)70321-5. Epub 2011 Jan 6.,1/11/2011,2011
2136,21216198,Dutasteride for spinal and bulbar muscular atrophy.,"Banno H, Katsuno M, Suzuki K, Sobue G.",Lancet Neurol. 2011 Feb;10(2):113-5. doi: 10.1016/S1474-4422(10)70324-0. Epub 2011 Jan 6. No abstract available.,1/11/2011,2011
2140,21247881,"Mutant CAG repeats of Huntingtin transcript fold into hairpins, form nuclear foci and are targets for RNA interference.","de Mezer M, Wojciechowska M, Napierala M, Sobczak K, Krzyzosiak WJ.",Nucleic Acids Res. 2011 May;39(9):3852-63. doi: 10.1093/nar/gkq1323. Epub 2011 Jan 18.,1/21/2011,2011
2143,21284948,"Role of the androgen receptor CAG repeat polymorphism in prostate cancer, and spinal and bulbar muscular atrophy.","Kumar R, Atamna H, Zakharov MN, Bhasin S, Khan SH, Jasuja R.",Life Sci. 2011 Mar 28;88(13-14):565-71. doi: 10.1016/j.lfs.2011.01.021. Epub 2011 Jan 31. Review.,2/3/2011,2011
2147,21317158,Absence of disturbed axonal transport in spinal and bulbar muscular atrophy.,"Malik B, Nirmalananthan N, Bilsland LG, La Spada AR, Hanna MG, Schiavo G, Gallo JM, Greensmith L.",Hum Mol Genet. 2011 May 1;20(9):1776-86. doi: 10.1093/hmg/ddr061. Epub 2011 Feb 11.,2/15/2011,2011
2150,21386698,Interaction of ataxin-3 with huntingtin-associated protein 1 through Josephin domain.,"Takeshita Y, Fujinaga R, Kokubu K, Islam MN, Jahan MR, Yanai A, Kakizuka A, Shinoda K.",Neuroreport. 2011 Mar 30;22(5):232-8. doi: 10.1097/WNR.0b013e32834505f4.,3/10/2011,2011
2153,21698646,Clarifying variability of corticomotoneuronal function in kennedy disease.,"Vucic S, Kiernan MC.",Muscle Nerve. 2011 Aug;44(2):197-201. doi: 10.1002/mus.22017. Epub 2011 Jun 22.,6/24/2011,2011
2156,21745497,Neurotoxic effects of androgens in spinal and bulbar muscular atrophy.,"Parodi S, Pennuto M.",Front Neuroendocrinol. 2011 Oct;32(4):416-25. doi: 10.1016/j.yfrne.2011.06.003. Epub 2011 Jul 1. Review.,7/13/2011,2011
2159,21796517,Molecular mechanisms of androgen action--a historical perspective.,Brinkmann AO.,Methods Mol Biol. 2011;776:3-24. doi: 10.1007/978-1-61779-243-4_1. Review.,7/29/2011,2011
2163,21808858,Tremor in X-linked recessive spinal and bulbar muscular atrophy (Kennedy's disease).,"Dias FA, Munhoz RP, Raskin S, Werneck LC, Teive HA.",Clinics (Sao Paulo). 2011;66(6):955-7.,8/3/2011,2011
2166,21826683,Evaluation of spinal and bulbar muscular atrophy by the clustering index method.,"Higashihara M, Sonoo M, Yamamoto T, Nagashima Y, Uesugi H, Terao Y, Ugawa Y, Stålberg E, Tsuji S.",Muscle Nerve. 2011 Oct;44(4):539-46. doi: 10.1002/mus.22119. Epub 2011 Aug 8.,8/10/2011,2011
2169,21862330,Double trouble: spinal muscular atrophy type II and seropositive myasthenia gravis in the same patient.,"Jokela M, Udd B, Päivärinta M.",Neuromuscul Disord. 2012 Feb;22(2):129-30. doi: 10.1016/j.nmd.2011.07.011. Epub 2011 Aug 20.,8/25/2011,2011
2173,21873607,Impaired motoneuronal retrograde transport in two models of SBMA implicates two sites of androgen action.,"Kemp MQ, Poort JL, Baqri RM, Lieberman AP, Breedlove SM, Miller KE, Jordan CL.",Hum Mol Genet. 2011 Nov 15;20(22):4475-90. doi: 10.1093/hmg/ddr380. Epub 2011 Aug 26.,8/30/2011,2011
2176,21882412,Huntington’s Disease Pathogenesis: Mechanisms and Pathways.,"La Spada AR, Weydt P, Pineda VV.","In: Lo DC, Hughes RE, editors. Neurobiology of Huntington's Disease: Applications to Drug Discovery. Boca Raton (FL): CRC Press/Taylor &amp; Francis; 2011. Chapter 2.",9/2/2011,2011
2179,21921465,[Molecular-targeted therapy for spinal and bulbar muscular atrophy (SBMA)].,Sobue G.,Rinsho Shinkeigaku. 2010 Nov;50(11):839-41. Review. Japanese.,9/17/2011,2011
2182,21940987,A case of spinal and bulbar muscular atrophy with high-stage and high-Gleason Score prostate cancer responded to maximal androgen blockade therapy.,"Kosaka T, Miyajima A, Kikuchi E, Takahashi S, Suzuki N, Oya M.",J Androl. 2012 Jul-Aug;33(4):563-5. doi: 10.2164/jandrol.111.013698. Epub 2011 Sep 22.,9/24/2011,2011
2185,21952871,Difference in chronological changes of outcome measures between untreated and placebo-treated patients of spinal and bulbar muscular atrophy.,"Hashizume A, Katsuno M, Banno H, Suzuki K, Suga N, Tanaka F, Sobue G.",J Neurol. 2012 Apr;259(4):712-9. doi: 10.1007/s00415-011-6251-2. Epub 2011 Sep 28.,9/29/2011,2011
2189,21954065,Testosterone treatment fails to accelerate disease in a transgenic mouse model of spinal and bulbar muscular atrophy.,"Chevalier-Larsen ES, Merry DE.",Dis Model Mech. 2012 Jan;5(1):141-5. doi: 10.1242/dmm.007849. Epub 2011 Oct 4.,9/29/2011,2011
2192,21984161,[Clinical and genetic analysis of a pedigree of Kennedy disease].,"Ou-Yang ZY, Song SJ, Liu JR, Zhang BR, Wu DW.",Zhejiang Da Xue Xue Bao Yi Xue Ban. 2011 Sep;40(5):555-8. Chinese.,10/11/2011,2011
2195,22006688,Subclinical autonomic dysfunction in spinobulbar muscular atrophy (Kennedy disease).,"Rocchi C, Greco V, Urbani A, Di Giorgio A, Priori M, Massa R, Bernardi G, Marfia GA.",Muscle Nerve. 2011 Nov;44(5):737-40. doi: 10.1002/mus.22159.,10/19/2011,2011
2199,22022281,Macroautophagy is regulated by the UPR-mediator CHOP and accentuates the phenotype of SBMA mice.,"Yu Z, Wang AM, Adachi H, Katsuno M, Sobue G, Yue Z, Robins DM, Lieberman AP.",PLoS Genet. 2011 Oct;7(10):e1002321. doi: 10.1371/journal.pgen.1002321. Epub 2011 Oct 13.,10/25/2011,2011
2202,22131404,SIRT1 modulates aggregation and toxicity through deacetylation of the androgen receptor in cell models of SBMA.,"Montie HL, Pestell RG, Merry DE.",J Neurosci. 2011 Nov 30;31(48):17425-36. doi: 10.1523/JNEUROSCI.3958-11.2011.,12/2/2011,2011
2205,22158719,Molecular pathophysiology and disease-modifying therapies for spinal and bulbar muscular atrophy.,"Katsuno M, Banno H, Suzuki K, Adachi H, Tanaka F, Sobue G.",Arch Neurol. 2012 Apr;69(4):436-40. doi: 10.1001/archneurol.2011.2308. Epub 2011 Dec 12.,12/14/2011,2011
2208,23560305,Dynamic mutations: where are they now?,"van Eyk CL, Richards RI.",Adv Exp Med Biol. 2012;769:55-77. Review.,1/1/2012,2012
2211,23560310,Kennedy's disease: clinical significance of tandem repeats in the androgen receptor.,"Zajac JD, Fui MN.",Adv Exp Med Biol. 2012;769:153-68. Review.,1/1/2012,2012
2214,22233359,CAG repeat length in androgen receptor gene is not associated with amyotrophic lateral sclerosis.,"Bruson A, Sambataro F, Querin G, D'Ascenzo C, Palmieri A, Agostini J, Gaiani A, Angelini C, Galbiati M, Poletti A, Pennuto M, Pegoraro E, Clementi M, Soraru G.",Eur J Neurol. 2012 Oct;19(10):1373-5. doi: 10.1111/j.1468-1331.2011.03646.x. Epub 2012 Jan 10.,1/12/2012,2012
2217,22246870,Discrimination of spinal and bulbar muscular atrophy from amyotrophic lateral sclerosis using sensory nerve action potentials.,"Hama T, Hirayama M, Hara T, Nakamura T, Atsuta N, Banno H, Suzuki K, Katsuno M, Tanaka F, Sobue G.",Muscle Nerve. 2012 Feb;45(2):169-74. doi: 10.1002/mus.22291.,1/17/2012,2012
2220,22277380,[Development of disease-modifying therapy for neurodegenerative diseases].,Sobue G.,Rinsho Shinkeigaku. 2011 Nov;51(11):821-4. Japanese.,1/27/2012,2012
2223,22277449,[TGF-beta signaling in neurodegenerative diseases].,"Katsuno M, Banno H, Suzuki K, Adachi H, Tanaka F, Sobue G.",Rinsho Shinkeigaku. 2011 Nov;51(11):982-5. Japanese.,1/27/2012,2012
2226,22277500,[Electrodiagnosis of ALS: its practical aspects].,"Sonoo M, Higashihara M, Hokkoku K.",Rinsho Shinkeigaku. 2011 Nov;51(11):1111-3. Japanese.,1/27/2012,2012
2229,22295834,[Case of spinal and bulbar muscular atrophy].,Zhang QR.,Zhongguo Zhen Jiu. 2012 Jan;32(1):78. Chinese.  No abstract available.,2/3/2012,2012
2232,22311934,Teaching Video NeuroImages: spinal and bulbar muscular atrophy mimicking essential tremor.,"Kerasnoudis A, Ellrichmann G, Gold R, Saft C.",Neurology. 2012 Feb 7;78(6):e41. doi: 10.1212/WNL.0b013e318245d2bd. No abstract available.,2/9/2012,2012
2236,22312314,Disruption of axonal transport in motor neuron diseases.,"Ikenaka K, Katsuno M, Kawai K, Ishigaki S, Tanaka F, Sobue G.",Int J Mol Sci. 2012;13(1):1225-38. doi: 10.3390/ijms13011225. Epub 2012 Jan 23. Review.,2/9/2012,2012
2240,22327341,Neurogenic and myogenic contributions to hereditary motor neuron disease.,"Bricceno KV, Fischbeck KH, Burnett BG.",Neurodegener Dis. 2012;9(4):199-209. doi: 10.1159/000335311. Epub 2012 Feb 9. Review.,2/14/2012,2012
2243,22366762,Toxic and non-toxic aggregates from the SBMA and normal forms of androgen receptor have distinct oligomeric structures.,"Jochum T, Ritz ME, Schuster C, Funderburk SF, Jehle K, Schmitz K, Brinkmann F, Hirtz M, Moss D, Cato AC.",Biochim Biophys Acta. 2012 Jun;1822(6):1070-8. doi: 10.1016/j.bbadis.2012.02.006. Epub 2012 Feb 15.,3/1/2012,2012
2246,22381992,Complications after cardiovascular surgery in a case of undiagnosed spinal-bulbar muscular atrophy (Kennedy disease).,"Skoretz SA, Yee MS, Martino R.",Am J Crit Care. 2012 Mar;21(2):139-8. doi: 10.4037/ajcc2012453.,3/3/2012,2012
2249,22402717,[Disease-modifying therapy for spinal and bulbar muscular atrophy (SBMA)].,"Suzuki K, Banno H, Katsuno M, Adachi H, Tanaka F, Sobue G.",Brain Nerve. 2012 Mar;64(3):237-44. Review. Japanese.,3/10/2012,2012
2253,22415521,Growth assays to assess polyglutamine toxicity in yeast.,Duennwald ML.,J Vis Exp. 2012 Mar 5;(61):e3461. doi: 10.3791/3461.,3/15/2012,2012
2257,22438791,Post-translational modifications of nuclear receptors and human disease.,"Anbalagan M, Huderson B, Murphy L, Rowan BG.",Nucl Recept Signal. 2012;10:e001. doi: 10.1621/nrs.10001. Epub 2012 Feb 27. Review.,3/23/2012,2012
2260,22476656,Pathogenesis and molecular targeted therapy of spinal and bulbar muscular atrophy (SBMA).,"Banno H, Katsuno M, Suzuki K, Tanaka F, Sobue G.",Cell Tissue Res. 2012 Jul;349(1):313-20. doi: 10.1007/s00441-012-1377-9. Epub 2012 Apr 4. Review.,4/6/2012,2012
2263,22503213,Cancer incidence in patients with polyglutamine diseases: a population-based study in Sweden.,"Ji J, Sundquist K, Sundquist J.",Lancet Oncol. 2012 Jun;13(6):642-8. doi: 10.1016/S1470-2045(12)70132-8. Epub 2012 Apr 12.,4/17/2012,2012
2266,22570336,Disruption of nongenomic testosterone signaling in a model of spinal and bulbar muscular atrophy.,"Schindler M, Fabre C, de Weille J, Carreau S, Mersel M, Bakalara N.",Mol Endocrinol. 2012 Jul;26(7):1102-16. doi: 10.1210/me.2011-1367. Epub 2012 May 8.,5/10/2012,2012
2269,22609045,Pathogenesis and therapy of spinal and bulbar muscular atrophy (SBMA).,"Katsuno M, Tanaka F, Adachi H, Banno H, Suzuki K, Watanabe H, Sobue G.",Prog Neurobiol. 2012 Dec;99(3):246-56. doi: 10.1016/j.pneurobio.2012.05.007. Epub 2012 May 15. Review.,5/23/2012,2012
2272,22613760,Frontal dysfunctions of ALS-PBP patients in relation to their bulbar symptoms and rCBF decline.,"Morimoto N, Kurata T, Sato K, Ikeda Y, Sato S, Abe K.",J Neurol Sci. 2012 Aug 15;319(1-2):96-101. doi: 10.1016/j.jns.2012.04.020. Epub 2012 May 19.,5/23/2012,2012
2275,22660636,Viral delivery of miR-196a ameliorates the SBMA phenotype via the silencing of CELF2.,"Miyazaki Y, Adachi H, Katsuno M, Minamiyama M, Jiang YM, Huang Z, Doi H, Matsumoto S, Kondo N, Iida M, Tohnai G, Tanaka F, Muramatsu S, Sobue G.",Nat Med. 2012 Jul;18(7):1136-41. doi: 10.1038/nm.2791.,6/5/2012,2012
2279,22668795,Developing treatment for spinal and bulbar muscular atrophy.,Fischbeck KH.,Prog Neurobiol. 2012 Dec;99(3):257-61. doi: 10.1016/j.pneurobio.2012.05.012. Epub 2012 Jun 2. Review.,6/7/2012,2012
2283,22720173,Current status of treatment of spinal and bulbar muscular atrophy.,"Tanaka F, Katsuno M, Banno H, Suzuki K, Adachi H, Sobue G.",Neural Plast. 2012;2012:369284. doi: 10.1155/2012/369284. Epub 2012 Jun 7. Review.,6/22/2012,2012
2287,22736030,A polyglutamine expansion disease protein sequesters PTIP to attenuate DNA repair and increase genomic instability.,"Xiao H, Yu Z, Wu Y, Nan J, Merry DE, Sekiguchi JM, Ferguson DO, Lieberman AP, Dressler GR.",Hum Mol Genet. 2012 Oct 1;21(19):4225-36. doi: 10.1093/hmg/dds246. Epub 2012 Jun 26.,6/28/2012,2012
2290,22773541,Longitudinal changes of outcome measures in spinal and bulbar muscular atrophy.,"Hashizume A, Katsuno M, Banno H, Suzuki K, Suga N, Mano T, Atsuta N, Oe H, Watanabe H, Tanaka F, Sobue G.",Brain. 2012 Sep;135(Pt 9):2838-48. doi: 10.1093/brain/aws170. Epub 2012 Jul 6.,7/10/2012,2012
2294,22829593,The in vivo role of androgen receptor SUMOylation as revealed by androgen insensitivity syndrome and prostate cancer mutations targeting the proline/glycine residues of synergy control motifs.,"Mukherjee S, Cruz-Rodríguez O, Bolton E, Iñiguez-Lluhí JA.",J Biol Chem. 2012 Sep 7;287(37):31195-206. doi: 10.1074/jbc.M112.395210. Epub 2012 Jul 24.,7/26/2012,2012
2297,22872761,Regulation of the androgen receptor by post-translational modifications.,"Coffey K, Robson CN.",J Endocrinol. 2012 Nov;215(2):221-37. doi: 10.1530/JOE-12-0238. Epub 2012 Aug 7. Review.,8/9/2012,2012
2301,22900086,Conditional knockout of the Menkes disease copper transporter demonstrates its critical role in embryogenesis.,"Wang Y, Zhu S, Weisman GA, Gitlin JD, Petris MJ.",PLoS One. 2012;7(8):e43039. doi: 10.1371/journal.pone.0043039. Epub 2012 Aug 10.,8/18/2012,2012
2305,22919202,Klinefelter's syndrome associated with progressive muscular atrophy simulating Kennedy's disease.,Caballero PE.,Ann Indian Acad Neurol. 2012 Jul;15(3):227-9. doi: 10.4103/0972-2327.99730.,8/25/2012,2012
2308,22941760,Cross-sectional and longitudinal analysis of an oxidative stress biomarker for spinal and bulbar muscular atrophy.,"Mano T, Katsuno M, Banno H, Suzuki K, Suga N, Hashizume A, Tanaka F, Sobue G.",Muscle Nerve. 2012 Nov;46(5):692-7. doi: 10.1002/mus.23413. Epub 2012 Aug 31.,9/4/2012,2012
2312,22952056,Insulinlike growth factor (IGF)-1 administration ameliorates disease manifestations in a mouse model of spinal and bulbar muscular atrophy.,"Rinaldi C, Bott LC, Chen KL, Harmison GG, Katsuno M, Sobue G, Pennuto M, Fischbeck KH.",Mol Med. 2012 Dec 6;18:1261-8. doi: 10.2119/molmed.2012.00271.,9/7/2012,2012
2315,23023499,Naratriptan mitigates CGRP1-associated motor neuron degeneration caused by an expanded polyglutamine repeat tract.,"Minamiyama M, Katsuno M, Adachi H, Doi H, Kondo N, Iida M, Ishigaki S, Fujioka Y, Matsumoto S, Miyazaki Y, Tanaka F, Kurihara H, Sobue G.",Nat Med. 2012 Oct;18(10):1531-8. doi: 10.1038/nm.2932. Epub 2012 Sep 30.,10/2/2012,2012
2318,23024039,Role of androgen receptor polyQ chain elongation in Kennedy's disease and use of natural osmolytes as potential therapeutic targets.,Kumar R.,IUBMB Life. 2012 Nov;64(11):879-84. doi: 10.1002/iub.1088. Epub 2012 Sep 29. Review.,10/2/2012,2012
2321,23062703,FUS is not dysregulated by the spinal bulbar muscular atrophy androgen receptor polyglutamine repeat expansion.,"Fratta P, Malik B, Gray A, La Spada AR, Hanna MG, Fisher EM, Greensmith L.",Neurobiol Aging. 2013 May;34(5):1516.e17-9. doi: 10.1016/j.neurobiolaging.2012.09.008. Epub 2012 Oct 9.,10/16/2012,2012
2324,23121864,Goserelin cannot improve the weakness of a patient with kennedy disease after 40-week administration.,"Shi ZG, Jiang DK, Zhao M, Zhang SQ.",CNS Neurosci Ther. 2012 Dec;18(12):1021-3. doi: 10.1111/cns.12022. Epub 2012 Nov 2. No abstract available.,11/6/2012,2012
2327,23146615,Assessment of swallowing in motor neuron disease and Asidan/SCA36 patients with new methods.,"Morimoto N, Yamashita T, Sato K, Kurata T, Ikeda Y, Kusuhara T, Murata N, Abe K.",J Neurol Sci. 2013 Jan 15;324(1-2):149-55. doi: 10.1016/j.jns.2012.10.025. Epub 2012 Nov 10.,11/14/2012,2012
2330,23157556,The androgen receptor in health and disease.,"Matsumoto T, Sakari M, Okada M, Yokoyama A, Takahashi S, Kouzmenko A, Kato S.",Annu Rev Physiol. 2013;75:201-24. doi: 10.1146/annurev-physiol-030212-183656. Epub 2012 Nov 13. Review.,11/20/2012,2012
2333,23196565,[Anti-androgen therapy for spinal and bulbar muscular atrophy (SBMA)].,"Katsuno M, Banno H, Suzuki K, Hashizume A, Adachi H, Tanaka F, Sobue G.",Rinsho Shinkeigaku. 2012;52(11):1207-9. Japanese.,12/1/2012,2012
2336,23196579,"[Non-invasive quantitative EMG: invention of the ""Clustering Index (CI)"" method].","Uesugi H, Sonoo M, Higashihara M, Stalberg E, Saito H.",Rinsho Shinkeigaku. 2012;52(11):1249-51. Japanese.,12/1/2012,2012
2339,23216624,Structural changes of central white matter tracts in Kennedy's disease - a diffusion tensor imaging and voxel-based morphometry study.,"Pieper CC, Konrad C, Sommer J, Teismann I, Schiffbauer H.",Acta Neurol Scand. 2013 May;127(5):323-8. doi: 10.1111/ane.12018. Epub 2012 Dec 6.,12/12/2012,2012
2343,23222885,Activation of Hsp70 reduces neurotoxicity by promoting polyglutamine protein degradation.,"Wang AM, Miyata Y, Klinedinst S, Peng HM, Chua JP, Komiyama T, Li X, Morishima Y, Merry DE, Pratt WB, Osawa Y, Collins CA, Gestwicki JE, Lieberman AP.",Nat Chem Biol. 2013 Feb;9(2):112-8. doi: 10.1038/nchembio.1140. Epub 2012 Dec 9.,12/12/2012,2012
2347,23247071,"CUG-BP, Elav-like family (CELF)-mediated alternative splicing regulation in the brain during health and disease.",Ladd AN.,Mol Cell Neurosci. 2013 Sep;56:456-64. doi: 10.1016/j.mcn.2012.12.003. Epub 2012 Dec 14. Review.,12/19/2012,2012
2351,23346158,Decremental responses to repetitive nerve stimulation in x-linked bulbospinal muscular atrophy.,"Kim JY, Park KD, Kim SM, Sunwoo IN.",J Clin Neurol. 2013 Jan;9(1):32-5. doi: 10.3988/jcn.2013.9.1.32. Epub 2013 Jan 3.,1/25/2013,2013
2354,23360996,Heat shock factor-1 influences pathological lesion distribution of polyglutamine-induced neurodegeneration.,"Kondo N, Katsuno M, Adachi H, Minamiyama M, Doi H, Matsumoto S, Miyazaki Y, Iida M, Tohnai G, Nakatsuji H, Ishigaki S, Fujioka Y, Watanabe H, Tanaka F, Nakai A, Sobue G.",Nat Commun. 2013;4:1405. doi: 10.1038/ncomms2417.,1/31/2013,2013
2357,23363377,"Genistein, a natural product derived from soybeans, ameliorates polyglutamine-mediated motor neuron disease.","Qiang Q, Adachi H, Huang Z, Jiang YM, Katsuno M, Minamiyama M, Doi H, Matsumoto S, Kondo N, Miyazaki Y, Iida M, Tohnai G, Sobue G.",J Neurochem. 2013 Jul;126(1):122-30. doi: 10.1111/jnc.12172. Epub 2013 Feb 27.,2/1/2013,2013
